### ISSUE TITLE
http_request::extract_string extremely slow

### ISSUE THREAD

**Issue by mobileben** [microsoft/cpprestsdk#1189]
I have a server currently running on an AWS instance (md5.large). I'm currently in the process of figuring out why calls have way more latency than expected.

I'm currently rapidjson for JSON deserialization. So when my listener is called and after I have validated the request, I extract the body as a string to pass along to the appropriate handlers. This string is then deserialized with rapidjson.

I do this via

` 
 std::string body = request.extract_string().get();
`

I have found out, however that this call takes roughly 60000 to 120000 microseconds. Although when running on my iMac Pro, it takes a fraction of the time (50 to 500 microseconds), however this is servicing requests which are running on localhost. This translates to the time to service a request effectively being the time it takes to run `extract_string`, since it eclipses all other processing by quite a bit. In diagnosing this, I have several time samples which are being logged, which allows me to be able to make the comparison

One key thing to mention here. For these particular requests, the body is 70 bytes. That's right, only 70 bytes. This is running on a dev instance with me being the only person making the requests.

I tried to use `body()` directly but have found that when I use it, it ends up with an empty string. Which leaves me to believe that even though the listener has notified me of the request, the body isn't loaded. I basically took some of the existing code from `extract_string` to try and get the contents of the body.

```
    auto buf_r = request.body().streambuf();
    body.resize((std::string::size_type)buf_r.in_avail());
    buf_r.getn(const_cast<uint8_t*>(reinterpret_cast<const uint8_t*>(body.data())), body.size())
    .get(); // There is no risk of blocking.
```

On my IMP I get get the body. On the AWS instance, it results in an empty string. From this it would appear there is still some buffering or something else 

This also leads me to believe that pplx tasking is woefully inefficient. Which does make me also wonder about the overall efficiency of cpprestsdk, since much of it seems reliant on pplx for tasking.

Hoping someone can shed some light here. As well as if there is there a proper way to get the body without using pplx? And has there been any benchmarking on just how performant this SDK is? In particular, how efficient pplx is?

**Comment by mobileben** [comment]
Linking #468 since these may be related.

I've done some more experimentation by way of adding in debug while running.

I've measured some parts, and it really isn't clear to me yet where the slowdown is from. 

In this one example, it took 161168  microseconds to execute this. `extract_string` will result in 2 tasks being scheduled. I've timed the time for `handle_body` to process. It's 40 microseconds. The actual implementation (`http_msg`) for `extract_string` takes 20 microseconds. This ends up looking like around 160000 microseconds for pplx?

I'm adding some more profiling debug to see if it can shed some better light on what's wrong. I'm going to add microsecond timestamps so I can see when certain events happen to see if I can determine where these delays are stemming from.

Note that I'm in the Bay Area and am using us-west-2 as my AWS region. I'm seeing round trip times around 120ms - 300ms. This is actually quite disappointing and am really hoping there is some huge error on my side.

The instance is running Ubuntu 16.04. This is actually a game server. The client is also using cpprestsdk. I haven't timed things on the client yet. But as stated, this time is significantly lower on MacOs than on Ubuntu. 

I have been running an experiment using `std::async` for both the scheduler on MacOs and on Ubuntu. MacOs was using `GCD`. The calls are slightly slower on MacOs with `std::async` but still significantly faster than on Ubuntu.

I've also disabled Nagle as an experiment. But the times are roughly the same still.

**Comment by mobileben** [comment]
I do have a quick update. I'm throwing this out there in case anyone can shed any ideas as the to why or wants to conduct their own experiments around this. Note that it isn't fully clear to me if for some reason the network is slow. I am running Ubuntu 16.04 on a md5.large instance which should have up to 10Gbit connection. It does go through an ALB. It also happened to be containerized, but I just ran an experiment of running it outside the container, but the results are the same. In general, the payloads of the body are quite small. They tend to be roughly 658 bytes (body is 124 bytes). I find it hard to fathom that after the header is ready it can range from 60-200ms or even more for those last 124 bytes.

The actual last call I can trace to is

```
void asio_server_connection::async_read_until_buffersize(size_t size, const ReadHandler& handler)
```

The is in http_server_asio.cpp. Essentially I print a timestamp prior to calling `boost::async_read`. The handler is `handle_body`. There I print out another timestamp. 

That is how I'm generating the time delay.

I generate the timestamps as follows

```
std::chrono::duration_cast<std::chrono::microseconds>(std::chrono::system_clock::now().time_since_epoch()).count();
```

I've also enabled handler tracking in Asio and started to take tcpdumps, although admittedly I don't know quite how to read them yet.

It does suggest though there is some unknown delay, so I suppose it is possible the data just isn't ready. Is it possible that for some reason there is a request to get the rest of the bytes from the server?

> @asio|1563329672.068779|0*1180|socket@0x7fb6f4002998.async_send
> @asio|1563329672.068818|.1180|non_blocking_send,ec=system:0,bytes_transferred=73
> @asio|1563329672.068857|>1180|ec=system:0,bytes_transferred=73
> @asio|1563329672.068873|<1180|
> @asio|1563329672.068880|0*1181|socket@0x7fb6f4002998.async_send
> @asio|1563329672.068949|.1181|non_blocking_send,ec=system:0,bytes_transferred=4096
> @asio|1563329672.068969|>1181|ec=system:0,bytes_transferred=4096
> @asio|1563329672.068996|<1181|
> @asio|1563329672.069051|0*1182|socket@0x7fb6f4002998.async_send
> @asio|1563329672.069078|.1182|non_blocking_send,ec=system:0,bytes_transferred=1844
> @asio|1563329672.069099|>1182|ec=system:0,bytes_transferred=1844
> @asio|1563329672.069125|1182*1183|socket@0x7fb6f4002998.async_receive
> @asio|1563329672.069131|.1183|non_blocking_recv,ec=system:11,bytes_transferred=0
> @asio|1563329672.069134|<1182|
> @asio|1563329676.094491|.1183|non_blocking_recv,ec=system:0,bytes_transferred=534
> @asio|1563329676.094517|>1183|ec=system:0,bytes_transferred=534
> @asio|1563329676.094664|1183*1184|socket@0x7fb6f4002998.async_receive
> @asio|1563329676.094672|.1184|non_blocking_recv,ec=system:11,bytes_transferred=0
> @asio|1563329676.095637|<1183|
> @asio|1563329676.164193|.1184|non_blocking_recv,ec=system:0,bytes_transferred=124
> @asio|1563329676.164209|>1184|ec=system:0,bytes_transferred=124
> @asio|1563329676.164241|<1184|
> @asio|1563329676.164640|0*1185|socket@0x7fb6f4002998.async_receive
> @asio|1563329676.164681|>1185|ec=system:0,bytes_transferred=0
> @asio|1563329676.164738|<1185|
> 

This is the corresponding `tcpdump`

> 02:14:32.069576 IP ip-.us-west-2.compute.internal.53192 > 87cff2a5aa3a.8181: Flags [.], ack 74, win 115, options [nop,nop,TS val 586447824 ecr 91230873], length 0
> 02:14:32.069633 IP ip-.us-west-2.compute.internal.53192 > 87cff2a5aa3a.8181: Flags [.], ack 1522, win 126, options [nop,nop,TS val 586447824 ecr 91230873], length 0
> 02:14:32.069638 IP ip-.us-west-2.compute.internal.53192 > 87cff2a5aa3a.8181: Flags [.], ack 2970, win 137, options [nop,nop,TS val 586447824 ecr 91230873], length 0
> 02:14:32.069689 IP ip-.us-west-2.compute.internal.53192 > 87cff2a5aa3a.8181: Flags [.], ack 4170, win 148, options [nop,nop,TS val 586447824 ecr 91230873], length 0
> 02:14:32.069765 IP ip-.us-west-2.compute.internal.53192 > 87cff2a5aa3a.8181: Flags [.], ack 5618, win 160, options [nop,nop,TS val 586447824 ecr 91230874], length 0
> 02:14:32.069838 IP ip-.us-west-2.compute.internal.53192 > 87cff2a5aa3a.8181: Flags [.], ack 6014, win 171, options [nop,nop,TS val 586447824 ecr 91230874], length 0
> 02:14:36.094453 IP ip-.us-west-2.compute.internal.53192 > 87cff2a5aa3a.8181: Flags [P.], seq 664:1198, ack 6014, win 171, options [nop,nop,TS val 586448830 ecr 91230874], length 534
> 02:14:36.132993 IP 87cff2a5aa3a.8181 > ip-.us-west-2.compute.internal.53192: Flags [.], ack 1198, win 252, options [nop,nop,TS val 91231890 ecr 586448830], length 0
> 02:14:36.164157 IP ip-.us-west-2.compute.internal.53192 > 87cff2a5aa3a.8181: Flags [P.], seq 1198:1322, ack 6014, win 171, options [nop,nop,TS val 586448847 ecr 91231890], length 124
> 02:14:36.164167 IP 87cff2a5aa3a.8181 > ip-.us-west-2.compute.internal.53192: Flags [.], ack 1322, win 252, options [nop,nop,TS val 91231897 ecr 586448847], length 0

What is curious is this call from the server back.

> 02:14:36.132993 IP 87cff2a5aa3a.8181 > ip-.us-west-2.compute.internal.53192: Flags [.], ack 1198, win 252, options [nop,nop,TS val 91231890 ecr 586448830], length 0

There is not correlating time in the Asio handler tracking.

**Comment by mobileben** [comment]
Alright another update. And I will post this on #468 as well as open a new issue to see if we can actually get this implemented properly.

I added `tcp::no_delay` to `http_client_asio`. This significantly brought down my RTT. What was variable from 100ms - 400ms on average has become around 70ms on average. More significantly, when I calculate that time now which was previously bound by the `extract_string`, that is tiny. Previously we're taking it was 100 ms - 400ms+. Now it's 155 microseconds. 

I am still doing some experimentation to see if I can better isolate the residual RTT latency (full server CPU time is roughly 4ms on the instance, so  still quite a bit of time is lost to transport) is coming from.

**Comment by danielmdPhantom** [comment]
Have the same problem. extract_string() take over 1000ms..I have tested with the latest version (cpprestsdk-2.10.15) and also latest websocketpp (websocketpp-0.8.1) and the problem remains. Am I supposed to enable tcp::no_delay myself or is it enabled by default? 
BTW my app is a cpprest server catering to REST requests in localhost.
